{
	"background_color": [ 0.846, 0.933, 0.949 ],
	"camera": {
		"position": [ -2.0, 1.0, 0.0 ],
		"target": [ 0.0, 0.0, 0.0 ],
		"up": [ 0.0, 1.0, 0.0 ],
		"client_width": 1280,
		"client_height": 720,
		"fov": 0.7853981
	},
	"bsdfs": [
		{
			"name": "glass",
			"type": "ideal_specular_dielectric",
			"albedo": {
				"type": "constant",
				"value": [ 1.0, 1.0, 1.0 ]
			},
			"ior": 1.35
		}
	],
	"media": [
		{
			"name": "red_scattering",
			"type": "isotropic_scattering",
			"absorption_color": [ 0.9801986733, 0.00609674656, 0.00334596545 ],
			"absorption_at_distance": 1.0,
			"scattering_distance": 0.1
		}
	],
	"materials": [
		{
			"name": "dragon_material",
			"bsdf": "glass",
			"medium": "red_scattering"
		}
	],
	"primitives": [
		{
			"name": "dragon",
			"type": "lmf",
			"file_path": "dragon.lmf",
			"material": "dragon_material"
		}
	]
}